{
  "artifacts": [
    {
      "path": "cargo-version.txt",
      "sha256": "fcfafeedf9e1047337cbc09d4b2279bbf73c68b0230dadfa2551a3122a92fe7c",
      "size": 336
    },
    {
      "path": "clippy.status.txt",
      "sha256": "9a271f2a916b0b6ee6cecb2426f0b3206ef074578be55d9bc94f6f3fe3ab86aa",
      "size": 2
    },
    {
      "path": "clippy.stderr",
      "sha256": "30a00eee35abdb3b741dde691883b782fb91f6c64a9eb9a06a0af9e6fafebff5",
      "size": 134
    },
    {
      "path": "clippy.stdout",
      "sha256": "eea0c8b2191f4fdab5629b788492437109cfe9434871a35f90b56102a3f4d467",
      "size": 192
    },
    {
      "path": "coverage.status.txt",
      "sha256": "9a271f2a916b0b6ee6cecb2426f0b3206ef074578be55d9bc94f6f3fe3ab86aa",
      "size": 2
    },
    {
      "path": "coverage.stderr",
      "sha256": "e3b0c44298fc1c149afbf4c8996fb92427ae41e4649b934ca495991b7852b855",
      "size": 0
    },
    {
      "path": "coverage.stdout",
      "sha256": "0a06e290a660db7ae206a9517f310b92c6ae7bf17ac852e8852e306cc6e618b0",
      "size": 212
    },
    {
      "path": "default-dependencies.status.txt",
      "sha256": "9a271f2a916b0b6ee6cecb2426f0b3206ef074578be55d9bc94f6f3fe3ab86aa",
      "size": 2
    },
    {
      "path": "default-dependencies.stderr",
      "sha256": "e3b0c44298fc1c149afbf4c8996fb92427ae41e4649b934ca495991b7852b855",
      "size": 0
    },
    {
      "path": "default-dependencies.stdout",
      "sha256": "152a1a12bb3fba2a97ef8ec6b0e4929fd6f0e153ea3d3de1a59f6dd5f531f6a6",
      "size": 71
    },
    {
      "path": "deny.status.txt",
      "sha256": "9a271f2a916b0b6ee6cecb2426f0b3206ef074578be55d9bc94f6f3fe3ab86aa",
      "size": 2
    },
    {
      "path": "deny.stderr",
      "sha256": "7e28b1654e4414b18b2b72a4396bbd0ff44a10c249c5422a8b41a4c78977f43b",
      "size": 1364
    },
    {
      "path": "deny.stdout",
      "sha256": "71dadc8c8978da797b94dc581b666330c737551839c8fc820d7647130930c4b7",
      "size": 12
    },
    {
      "path": "fmt.status.txt",
      "sha256": "9a271f2a916b0b6ee6cecb2426f0b3206ef074578be55d9bc94f6f3fe3ab86aa",
      "size": 2
    },
    {
      "path": "fmt.stderr",
      "sha256": "e3b0c44298fc1c149afbf4c8996fb92427ae41e4649b934ca495991b7852b855",
      "size": 0
    },
    {
      "path": "fmt.stdout",
      "sha256": "e3b0c44298fc1c149afbf4c8996fb92427ae41e4649b934ca495991b7852b855",
      "size": 0
    },
    {
      "path": "jsonschema-version.txt",
      "sha256": "33bdaf9e2d6bcbde2e4e613e865e403f8fe21fc621078d34c30b0bdc7f68d903",
      "size": 6
    },
    {
      "path": "kani-status.txt",
      "sha256": "2700165975f68815c97d605c56eca8e90d497ade1264b6282401d13fee99ac27",
      "size": 7
    },
    {
      "path": "kani-version.txt",
      "sha256": "c635232263cfca72ff15cc631e3f835220274793bb069f5eabaacbf5cb14a5c5",
      "size": 18
    },
    {
      "path": "kani.status.txt",
      "sha256": "9a271f2a916b0b6ee6cecb2426f0b3206ef074578be55d9bc94f6f3fe3ab86aa",
      "size": 2
    },
    {
      "path": "kani.stderr",
      "sha256": "c9979e7d6098ba9e3e9b7d585cab8dd49e9e95d3fc38f6d2e2aa412333e35306",
      "size": 156
    },
    {
      "path": "kani.stdout",
      "sha256": "f8ba931714da8174c610842d5574c8c9ab6ed0d3225723d8f722785e70f056a7",
      "size": 266663
    },
    {
      "path": "layout.status.txt",
      "sha256": "9a271f2a916b0b6ee6cecb2426f0b3206ef074578be55d9bc94f6f3fe3ab86aa",
      "size": 2
    },
    {
      "path": "layout.stderr",
      "sha256": "b2fb54a745b97134eec0874cf4f1c5d2c6dc61766005ad88dc449597bbfff5f7",
      "size": 138
    },
    {
      "path": "layout.stdout",
      "sha256": "792ccd060ef8e3cf3139d6df8c14c6533b9809062b1c28005ee18c84a1db52dc",
      "size": 118
    },
    {
      "path": "linked-footprint.status.txt",
      "sha256": "9a271f2a916b0b6ee6cecb2426f0b3206ef074578be55d9bc94f6f3fe3ab86aa",
      "size": 2
    },
    {
      "path": "linked-footprint.stderr",
      "sha256": "dd24cf2f3f0f27d19b17a4a93e0fdf96729faf1fffea9538f6d54f0fe7da201b",
      "size": 52
    },
    {
      "path": "linked-footprint.stdout",
      "sha256": "89c050fda455ac6c4c8d96d68989551648aee1d905e708c41922f81220c0764c",
      "size": 482
    },
    {
      "path": "metadata.status.txt",
      "sha256": "9a271f2a916b0b6ee6cecb2426f0b3206ef074578be55d9bc94f6f3fe3ab86aa",
      "size": 2
    },
    {
      "path": "metadata.stderr",
      "sha256": "e3b0c44298fc1c149afbf4c8996fb92427ae41e4649b934ca495991b7852b855",
      "size": 0
    },
    {
      "path": "metadata.stdout",
      "sha256": "91e20be2ab091799d71a45829965e026633911e28ac08fd4620c4a744d446a35",
      "size": 120945
    },
    {
      "path": "msrv-rustc-version.txt",
      "sha256": "7eab200f5307bd6b0fd9d257e06480351b842c8cbddf2e597103021073b4e6ee",
      "size": 196
    },
    {
      "path": "msrv.status.txt",
      "sha256": "9a271f2a916b0b6ee6cecb2426f0b3206ef074578be55d9bc94f6f3fe3ab86aa",
      "size": 2
    },
    {
      "path": "msrv.stderr",
      "sha256": "823e074d281074fab71ae3aaaf3df3dcbbef5ece346096e81944f9bd2c128875",
      "size": 62
    },
    {
      "path": "msrv.stdout",
      "sha256": "e3b0c44298fc1c149afbf4c8996fb92427ae41e4649b934ca495991b7852b855",
      "size": 0
    },
    {
      "path": "panic-audit.status.txt",
      "sha256": "9a271f2a916b0b6ee6cecb2426f0b3206ef074578be55d9bc94f6f3fe3ab86aa",
      "size": 2
    },
    {
      "path": "panic-audit.stderr",
      "sha256": "e3b0c44298fc1c149afbf4c8996fb92427ae41e4649b934ca495991b7852b855",
      "size": 0
    },
    {
      "path": "panic-audit.stdout",
      "sha256": "db63285c4097e72b51dac5b0b1cd887e5e61169a32ec0cd6c4d5ba89078de4a0",
      "size": 52
    },
    {
      "path": "pgm01-revision.txt",
      "sha256": "cfa9ce5bfbdec5066618e0f3bb5ea5356539a1f7e562a249f8769d681a9c20b7",
      "size": 41
    },
    {
      "path": "pgm01-schema-path.txt",
      "sha256": "71b64272d9fdb505147010727ac64ac1381fd47a95194d9fd22a0a7aacd72003",
      "size": 79
    },
    {
      "path": "pgm01-schema-sha256.txt",
      "sha256": "33d1c337ae9a612a2f724e7ec9b9688934f620c423402671ba5a50bde3004a68",
      "size": 65
    },
    {
      "path": "pgm01-validator-path.txt",
      "sha256": "21fc81641a8a1aa122dd53205fb29ab32e3a1b0eff67685c0604aff70f5308d9",
      "size": 58
    },
    {
      "path": "pgm01-validator-sha256.txt",
      "sha256": "9c0815b277093a5de065756331da2194f598de92d50760b17e8dbacdef3fed3e",
      "size": 65
    },
    {
      "path": "python-packages.txt",
      "sha256": "1324898e3beb06dc36ab35551f51edc415185329c798899c45476be04d532ad7",
      "size": 3955
    },
    {
      "path": "python-version.txt",
      "sha256": "f6b75e07f1488db28a89724a522725e3e01af3dc78f6fd365f17eb4059e41056",
      "size": 15
    },
    {
      "path": "quire-provenance.json",
      "sha256": "6df2f8c787012733dbcaab24f8810dd127a508513ba521a852592539c938ec91",
      "size": 664
    },
    {
      "path": "quire-validate.status.txt",
      "sha256": "9a271f2a916b0b6ee6cecb2426f0b3206ef074578be55d9bc94f6f3fe3ab86aa",
      "size": 2
    },
    {
      "path": "quire-validate.stderr",
      "sha256": "b490d70ffe44774238fa50820f6579c975ca17aecd4f1b03f8b24ad119f724eb",
      "size": 689
    },
    {
      "path": "quire-validate.stdout",
      "sha256": "0156d76c89e8d40eba6c6dccaed165b0397fabb2370b5832728e9d04fab1e8d2",
      "size": 24
    },
    {
      "path": "recorded-at.txt",
      "sha256": "cb3f67fa83f40dd2ca79f94f0e808cdbe0b87b18a8c45a9d65bc46229107e58c",
      "size": 21
    },
    {
      "path": "release-build.status.txt",
      "sha256": "9a271f2a916b0b6ee6cecb2426f0b3206ef074578be55d9bc94f6f3fe3ab86aa",
      "size": 2
    },
    {
      "path": "release-build.stderr",
      "sha256": "6bfa9e18ffdef821c711a542cfebd7db0982665615563e5a191285e489609c6f",
      "size": 62
    },
    {
      "path": "release-build.stdout",
      "sha256": "e3b0c44298fc1c149afbf4c8996fb92427ae41e4649b934ca495991b7852b855",
      "size": 0
    },
    {
      "path": "rlib-size-observation.status.txt",
      "sha256": "9a271f2a916b0b6ee6cecb2426f0b3206ef074578be55d9bc94f6f3fe3ab86aa",
      "size": 2
    },
    {
      "path": "rlib-size-observation.stderr",
      "sha256": "e3b0c44298fc1c149afbf4c8996fb92427ae41e4649b934ca495991b7852b855",
      "size": 0
    },
    {
      "path": "rlib-size-observation.stdout",
      "sha256": "100aa90174dbdb0c734a799bbc154c8aad923ca9dbd26cbb3b8d90dbe9e14bfa",
      "size": 149
    },
    {
      "path": "rustc-version.txt",
      "sha256": "a834181975ab3494d51a1a01e4a9d4321fecd674a52e3db3cf93b3b84b6fc2c1",
      "size": 196
    },
    {
      "path": "rustdoc.status.txt",
      "sha256": "9a271f2a916b0b6ee6cecb2426f0b3206ef074578be55d9bc94f6f3fe3ab86aa",
      "size": 2
    },
    {
      "path": "rustdoc.stderr",
      "sha256": "bf25baa94b4b4ce12ae4c2c82218835e6768a88ab9f725702f2a79dda1b8407f",
      "size": 434
    },
    {
      "path": "rustdoc.stdout",
      "sha256": "aef2b656e872fc4d1d6ae1b3e6adffd2eb0faa27e9c14dd46209d4bd12e14651",
      "size": 194
    },
    {
      "path": "size-version.txt",
      "sha256": "d3d27923df552f4580f4b13a788ecbdbbbb0ea1983f756a202351ceb8126958f",
      "size": 285
    },
    {
      "path": "source-revision.txt",
      "sha256": "70d2385d428603bc4db2770b0f6b275c5a55117f2b6c6f2cbde24d3df9901df3",
      "size": 41
    },
    {
      "path": "source-state.txt",
      "sha256": "2e22da2ab13713309ac75219e525b8e06ed02f3f1963b8feef203fa25827f93d",
      "size": 6
    },
    {
      "path": "test-all.status.txt",
      "sha256": "9a271f2a916b0b6ee6cecb2426f0b3206ef074578be55d9bc94f6f3fe3ab86aa",
      "size": 2
    },
    {
      "path": "test-all.stderr",
      "sha256": "2e254124b417aff359653a7c4f617112da0d547a0d18256302484cdecab6b8b9",
      "size": 701
    },
    {
      "path": "test-all.stdout",
      "sha256": "6cb9a2255604f4b7ddf6d29baddaddc8ffb278f8d8df274950f7eefa48d94f14",
      "size": 1918
    },
    {
      "path": "test-alloc.status.txt",